id|user_id|title|due_on|status
24698|4711768|Campana sordeo laudantium creber et coerceo.|20230923|pending
24680|4711734|Theca cenaculum calcar demo sumptus dolorem vir.|20230920|pending
24662|4689025|Voluptas comes quidem cetera alienus spargo voluptatem terebro.|20230920|completed
24661|4689024|Vacuus reiciendis admoveo omnis defetiscor conspergo cultura somnus claro.|20230919|pending
24686|4711745|Id defendo brevis accusamus tantillus cogito aeternus.|20230914|completed
24660|4689023|Despirmatio est totus curia angulus culpa titulus officiis.|20230906|pending
24659|4689022|Succurro aestas crustulum modi vere.|20230904|completed
24709|4711790|Ventito assentator pariatur valens delego armo.|20230902|completed
24694|4711759|Exercitationem animadverto textilis pecunia uterque deserunt desidero.|20230826|completed
24692|4711754|Coerceo tamisium circumvenio animi sponte.|20230826|pending
